texto,sentimento
"Amei a qualidade do produto, realmente excelente!",positivo
"Chegou muito rápido, fiquei impressionado com a entrega.",positivo
"Design moderno e funcional, cumpre o que promete.",positivo
"Me surpreendi positivamente, vale cada centavo!",positivo
"O material é resistente, exatamente o que eu precisava.",positivo
"Compra perfeita, voltarei a comprar com certeza.",positivo
"Produto correspondeu totalmente às minhas expectativas.",positivo
"Atendimento maravilhoso, equipe muito prestativa.",positivo
"Ótimo custo-benefício, recomendo para todos.",positivo
"Adorei o presente, uso todos os dias!",positivo
"Funcionou melhor do que eu esperava, parabéns!",positivo
"Embalagem impecável, sem nenhum defeito no transporte.",positivo
"Fiquei muito satisfeito, obrigado pela agilidade.",positivo
"Acabamento perfeito, qualidade excepcional.",positivo
"Produto superou minhas expectativas, ótimo investimento.",positivo
"Entrega antes do prazo, me impressionou!",positivo
"Sistema de configuração simples e intuitivo.",positivo
"Fácil de montar e começar a usar, muito prático.",positivo
"Bom desempenho, não travou em nenhum momento.",positivo
"Recomendei para meus amigos, todos adoraram!",positivo
"Cumpre tudo que promete, estou feliz com a compra.",positivo
"Ótimo suporte, resolveram minhas dúvidas rapidamente.",positivo
"Gostei demais do design, super elegante.",positivo
"Preço justo pela qualidade oferecida, vale a pena.",positivo
"Excelente durabilidade, aparentemente vai durar anos.",positivo
"Fiquei impressionada com o cuidado nos detalhes.",positivo
"Produto incrível e de fácil manuseio!",positivo
"Chegou tudo direitinho e bem embalado.",positivo
"Não tenho do que reclamar, entrega super pontual.",positivo
"Qualidade de primeira, recomendo sem dúvidas.",positivo
"Compatível com vários acessórios, muito versátil.",positivo
"Ótima experiência de compra do início ao fim.",positivo
"Atendeu perfeitamente às minhas necessidades.",positivo
"Sensacional! Melhor compra que fiz este mês.",positivo
"Funciona de forma fluida, sem engasgos.",positivo
"Nota dez em todos os quesitos, estou apaixonado.",positivo
"Senti muita segurança ao utilizar o produto.",positivo
"Já testei diversas vezes e não me decepcionou.",positivo
"Embalagem reciclável, adoro empresas sustentáveis.",positivo
"Design minimalista, super em alta.",positivo
"Coloquei altas expectativas e fui correspondido.",positivo
"O vendedor foi extremamente atencioso.",positivo
"Produto bem acabado, com ótimo acabamento externo.",positivo
"Um dos melhores que já comprei nessa categoria.",positivo
"Fácil de entender mesmo para iniciantes.",positivo
"A funcionalidade extra foi um grande bônus.",positivo
"Produto impressionante, amei desde o primeiro uso.",positivo
"Recebi vários elogios quando mostrei para meus amigos.",positivo
"Vou comprar outro para presentear um familiar.",positivo
"Vale cada real investido, satisfação total.",positivo
"Proporciona um ótimo desempenho no dia a dia.",positivo
"Achei muito bem construído, robusto e firme.",positivo
"Combina perfeitamente com meu ambiente de trabalho.",positivo
"Experiência de uso incrível, realmente facilita a vida.",positivo
"Exatamente como descrito, não decepciona.",positivo
"Uso diariamente e continua impecável.",positivo
"Sem palavras, a qualidade é fenomenal.",positivo
"Embalagem bem feita e chegou sem nenhum dano.",positivo
"Recomendo para quem busca praticidade e eficiência.",positivo
"É mais bonito pessoalmente do que nas fotos.",positivo
"Excelente retorno pelo valor investido.",positivo
"Super satisfeito, melhor do que as marcas concorrentes.",positivo
"Produto leve e muito confortável de usar.",positivo
"A marca é confiável e o produto faz jus ao nome.",positivo
"Foi um presente e a pessoa adorou.",positivo
"Instrutivo, veio com manual completo e ilustrado.",positivo
"Tudo funcionando perfeitamente, recomendo sem hesitar.",positivo
"Sensação de produto premium, não parece barato.",positivo
"Muito bem avaliado e realmente faz jus aos elogios.",positivo
"Entrega express, recebi muito antes do previsto.",positivo
"Faz o que promete, não deixa a desejar em nada.",positivo
"Interface amigável, não tive nenhuma dificuldade.",positivo
"Ótimo acabamento, não encontrei falhas.",positivo
"Durabilidade aparente é excelente, recomendo.",positivo
"Responde rápido aos comandos, sem lentidão.",positivo
"Minhas expectativas eram altas e foram superadas.",positivo
"Uma grata surpresa, já planejo comprar mais unidades.",positivo
"Seguro e confiável, uso até em viagens.",positivo
"O vendedor deu um ótimo suporte, tirou todas as dúvidas.",positivo
"Gostei do design e da cor, muito bonito.",positivo
"Meu produto favorito do momento, satisfação garantida.",positivo
"Nota 10, vale muito a pena adquirir.",positivo
"Foi simples de configurar, até minha avó conseguiu.",positivo
"A durabilidade me impressionou, parece indestrutível.",positivo
"Fiquei feliz com a compra, voltaria a comprar de novo.",positivo
"Marca muito conhecida e respeitada, atendeu bem.",positivo
"Embalado com cuidado, veio com instruções claras.",positivo
"Ótima experiência desde o unboxing.",positivo
"Sem complicações para instalar, muito prático.",positivo
"Exatamente o que eu procurava, não podia ser melhor.",positivo
"Boa relação preço versus performance.",positivo
"Veio lacrado e original, sem problemas de autenticidade.",positivo
"Já utilizei várias vezes e não ocorreu nenhum problema.",positivo
"A cor ficou ainda mais bonita ao vivo.",positivo
"Encaixe perfeito, não houve folgas ou defeitos.",positivo
"Muito útil no meu dia a dia, recomendo demais.",positivo
"O manual explica tudo, não restam dúvidas.",positivo
"Não trocaria por outro, estou muito satisfeito.",positivo
"Ótima reputação e mantém o padrão de excelência.",positivo
"Sem dúvidas, melhor aquisição do ano.",positivo
"Meus filhos adoraram, super seguro e divertido.",positivo
"Produto de ponta, bem acima da média.",positivo
"Recomendo vivamente, melhor compra em tempos.",positivo
"Excelente funcionalidade, se adapta a várias situações.",positivo
"O cuidado no acabamento é visível, muito bem feito.",positivo
"Minha experiência foi extremamente positiva!",positivo
"Estou encantado, recomendo para quem busca qualidade.",positivo
"Incrível desempenho, me ajudou bastante no trabalho.",positivo
"Cumpriu todas as promessas da descrição.",positivo
"Embalagem sustentável e produto de qualidade.",positivo
"Os reviews eram bons e confirmo que é ótimo!",positivo
"O suporte pós-venda é fantástico, me ajudaram muito.",positivo
"Totalmente satisfeito, uso sem medo.",positivo
"Recomendei a familiares e todos gostaram.",positivo
"Aprovadíssimo, não me arrependo de ter comprado.",positivo
"Estou impressionado com o resultado, excelente!",positivo
"Material superior aos concorrentes da mesma faixa.",positivo
"Foi minha melhor experiência de compra online.",positivo
"Bem construído, fácil de limpar e guardar.",positivo
"Discreto, funcional e com design inteligente.",positivo
"Poucos produtos entregam tanta qualidade, parabéns!",positivo
"Pronto, já virou meu favorito do dia a dia.",positivo
"Confesso que me surpreendeu muito positivamente.",positivo
"Adorei, já indiquei para vários amigos!",positivo
"Demorou bastante para chegar e veio com defeitos.",negativo
"Não atendeu às expectativas, fiquei decepcionado.",negativo
"Qualidade muito inferior ao descrito no anúncio.",negativo
"Entregaram o modelo errado e foi complicado trocar.",negativo
"Veio sem os acessórios principais, me senti enganado.",negativo
"Mal embalado, chegou amassado e com arranhões.",negativo
"Ficou travando e não consegui usar direito.",negativo
"Material frágil, parece que vai quebrar facilmente.",negativo
"O custo é alto para o que oferece, dinheiro mal gasto.",negativo
"O produto não funciona conforme o prometido.",negativo
"Extremamente difícil de configurar, nada intuitivo.",negativo
"Deixou a desejar na qualidade, não compraria de novo.",negativo
"A marca não é confiável, tive problemas anteriormente.",negativo
"O manual é confuso, não dá para entender nada.",negativo
"Produto fraco, não recomendo a ninguém.",negativo
"Suporte horrível, não me ajudaram em nada.",negativo
"Houve atraso na entrega e nenhuma justificativa.",negativo
"Péssimo atendimento, senti descaso total.",negativo
"Não encaixou bem, parecia ser compatível mas não é.",negativo
"Apresentou falhas logo no primeiro dia de uso.",negativo
"Textura desagradável, parece material de segunda.",negativo
"Esperava mais, principalmente pelo preço cobrado.",negativo
"Produto chegou todo riscado, lamentável.",negativo
"Foi difícil de instalar, perdi muito tempo.",negativo
"O marketing é enganoso, não cumpre o que promete.",negativo
"Minhas expectativas eram altas, mas me decepcionei.",negativo
"Comprei por impulso e me arrependi demais.",negativo
"Som de péssima qualidade, parece abafado.",negativo
"Funciona quando quer, sem confiabilidade.",negativo
"Tentei contato com o vendedor e não obtive resposta.",negativo
"Chegou faltando peças essenciais, não dá para usar.",negativo
"Não recomendo, pois o custo-benefício é péssimo.",negativo
"Em poucos dias já apresentou problemas técnicos.",negativo
"Defeito de fábrica, precisei devolver imediatamente.",negativo
"Não gostei do acabamento, muito mal feito.",negativo
"Excesso de propagandas sobre um produto ruim.",negativo
"A bateria descarrega muito rápido, inutilizável.",negativo
"É bonito mas nada funcional, pura frustração.",negativo
"Preço elevado para algo tão fraco e instável.",negativo
"Durou pouco, estragou em menos de uma semana.",negativo
"Não veio lacrado, parecia usado antes.",negativo
"A cor não corresponde à foto, muito diferente.",negativo
"Apresentou superaquecimento, perigoso usar.",negativo
"Não consigo sequer ligar, veio completamente defeituoso.",negativo
"Veio com arranhões, parece produto de mostruário.",negativo
"As avaliações positivas me enganaram, péssima compra.",negativo
"Ficou obsoleto em poucos dias, atualização horrível.",negativo
"Caixa toda amassada e o produto interno danificado.",negativo
"Perdeu a funcionalidade principal depois de um tempo.",negativo
"O cheiro é muito forte, não consigo usar.",negativo
"Interface cheia de bugs, trava frequentemente.",negativo
"Não recomendo para ninguém, experiência péssima.",negativo
"Barulhento e incomoda demais, não dá para suportar.",negativo
"Textura estranha, me deu alergia.",negativo
"Já veio violado, claramente não é novo.",negativo
"Nunca funcionou corretamente, decepção total.",negativo
"Muito pesado, nada prático para transportar.",negativo
"Suporte me ignorou após vários contatos.",negativo
"Quebrou no segundo uso, joguei dinheiro fora.",negativo
"Prometeram muitas funções, mas só metade funciona.",negativo
"Desgaste rápido, em poucos dias parecia velho.",negativo
"Embalagem parecia feita às pressas, zero cuidado.",negativo
"Não atende necessidades básicas, fraco demais.",negativo
"Assistência técnica distante e demorada.",negativo
"Comprei para presentear e passei vergonha.",negativo
"Fiquei frustrado, pois nem tentei devolver e perdi tempo.",negativo
"Minha pior experiência de compra online.",negativo
"Não aguenta uso contínuo, esquenta e desliga.",negativo
"A montagem foi complicada e sem instruções claras.",negativo
"O vendedor não explicou nada, não gostei.",negativo
"Manual em outro idioma, sem tradução disponível.",negativo
"Parece um produto genérico e de baixa categoria.",negativo
"Veio com peças soltas, dava para ouvir o barulho.",negativo
"Acabamento mal feito e aparência de produto falsificado.",negativo
"Visual até que é bom, mas o funcionamento é terrível.",negativo
"Uma enganação, não faz metade do prometido.",negativo
"Exige muitos cabos, nada prático de guardar.",negativo
"Atendimento por telefone inexistente, fiquei na mão.",negativo
"Falha de projeto, não serve para o propósito anunciado.",negativo
"Trava a todo instante, não consigo realizar tarefas simples.",negativo
"Precisaria de uma atualização urgente, mas não existe.",negativo
"Tem uma luminosidade muito fraca, quase inútil.",negativo
"Desconfortável de segurar, me deixou com dores.",negativo
"Fizeram propaganda enganosa sobre a durabilidade.",negativo
"Consome muita energia, minha conta veio altíssima.",negativo
"Não se conecta bem, fica caindo toda hora.",negativo
"O botão principal enroscou na primeira semana.",negativo
"Enviaram na cor errada e não aceitaram troca.",negativo
"Não oferece nenhum diferencial, é bem básico.",negativo
"Fiquei sem suporte e não consegui resolver defeitos.",negativo
"Os acessórios inclusos não servem pra nada.",negativo
"Minhas reclamações foram ignoradas no SAC.",negativo
"Relação custo-benefício é péssima, joguei dinheiro fora.",negativo
"O produto esquentou tanto que tive medo de usar.",negativo
"Design bonito, mas cheio de falhas internas.",negativo
"Pouco durável, em menos de um mês já estava danificado.",negativo
"Não recomendo, há opções bem melhores no mercado.",negativo
"Textos promocionais exagerados, não condizem com a realidade.",negativo
"O som é distorcido, impossível ouvir direito.",negativo
"Decepcionante, achei que seria de alta qualidade.",negativo
"Monte de peças que não se encaixam corretamente.",negativo
"A garantia é limitada, não cobre quase nada.",negativo
"Ninguém resolve meu problema, já tentei várias vezes.",negativo
"Não durou nem a primeira semana, muito frágil.",negativo
"Retirei da caixa e já notei marcas de uso.",negativo
"O cabo de alimentação não veio junto, absurdo.",negativo
"Erros constantes, o software é muito ruim.",negativo
"Tive que devolver, não valia a pena insistir.",negativo
"O leitor de cartão não funciona, defeito total.",negativo
"Nível de ruído altíssimo, me incomodou.",negativo
"Esperava bem mais, principalmente considerando o preço.",negativo
"Não se mostrou confiável, vivia desligando.",negativo
"Fui enganado pela propaganda, produto decepcionante.",negativo
"Parece de brinquedo, muito mal acabado.",negativo
"Depois de poucos dias, já parou de funcionar.",negativo
"Não comprem, vão se arrepender como eu.",negativo
"Vergonhoso, não sei como ainda vendem isso.",negativo
"Interface sem sentido, complicada de navegar.",negativo
"Foi caro e não me atende em nada, arrependida.",negativo
"Propaganda mentirosa, uma verdadeira decepção.",negativo
"Não possibilita nenhuma customização, muito limitado.",negativo
"Fica esquentando e desligando, impossível usar.",negativo
"Tudo muito confuso, não há instruções suficientes.",negativo
"Filtro de péssima qualidade, as fotos saíram ruins.",negativo
